number,name,link,tob,cate,season,situation,gender,tag,attr,nouns
782,무신사 스탠다드(MUSINSA STANDARD) 테크 스웨트 후디드 집업 [멜란지 그레이],https://store.musinsa.com/app/goods/1196489,top,hood zip up,spring,casual,남,아웃도어 테크스웨트컬렉션 트래블웨어 단독후드 한정후드 가을아우터 스웨트컬렉션 무탠픽업 베이식,Long Sleeved,신사 테크 스웨 후디 드 집 업 멜란지 그레이 아웃 도어 트래블 웨어 단독 후드 한정 후드 가을 아우 터 무태 픽업 베이식 
783,그루브라임(GROOVE RHYME) BASIC LOGO EMB HOOD ZIP-UP (BLACK) [LRPWCTZ341MBKA],https://store.musinsa.com/app/goods/1551945,top,hood zip up,spring,casual,공용,후드집업 오버핏 후드티 후드 후드티셔츠 셋업 오버핏후드,Black Female Long Sleeved,후드 집 업 후드 티 후드 후드 티셔츠 셋업 
784,페플(FP142) 950g 오리지널무지 집업후드 OGHD1933,https://store.musinsa.com/app/goods/262632,top,hood zip up,spring,casual,남,무지후드 무지후드티 후드집업 집업후드 집업,Female Long Sleeved,오리지널 무지 집 업 후드 무지 후드 무지 후드 티 후드 집 업 집 업 후드 집 업 
785,오와이(OY) 네트 스티치 니트 후드 집업-블랙,https://store.musinsa.com/app/goods/2524325,top,hood zip up,spring,casual,남,집업 집업후드 후드집업 니트집업 후디집업,Female Long Sleeved Round Neck,오와 이 네트 스티치 니트 후드 집 업 블랙 집 업 집 업 후드 후드 집 업 니트 집 업 후디 집 업 
786,오와이(OY) 네트 스티치 니트 후드 집업-아이보리,https://store.musinsa.com/app/goods/2524324,top,hood zip up,spring,casual,남,집업 집업후드 후드집업 니트집업 후디집업,Female Long Sleeved Round Neck,오와 이 네트 스티치 니트 후드 집 업 아이보리 집 업 집 업 후드 후드 집 업 니트 집 업 후디 집 업 
787,제멋(JEMUT) [패키지] 하이 양기모 후드 집업 HJHD2082,https://store.musinsa.com/app/goods/845566,top,hood zip up,spring,casual,남,기모후드 패키지 후드점퍼 후드집업 HOODY 기모,Female Long Sleeved,제멋 패키지 하이 기모 후드 집 업 기모 후드 패키지 후드 점퍼 후드 집 업 기모 
788,우알롱(WOOALONG) Signature crop hood zip-up - CREAM,https://store.musinsa.com/app/goods/2287404,top,hood zip up,spring,casual,여,집업 후드집업 후드티셔츠 후드 셋업 크롭 우알롱후드,Female,집 업 후드 집 업 후드 티셔츠 후드 셋업 
789,스컬프터(SCULPTOR) Inside-Out Zip-Up Melange-Reverse,https://store.musinsa.com/app/goods/1788828,top,hood zip up,spring,casual,여,셋업 집업 오버핏 아우터 집업자켓 후드집업 세트업,Female Long Sleeved Round Neck,셋업 집 업 아우 터 후드 집 업 세트 업 
790,더블유브이프로젝트(WV PROJECT) 와핑 후드집업 크림 JJOT7203,https://store.musinsa.com/app/goods/836977,top,hood zip up,spring,casual,여,집업 후드 후드집업 후드티,Female Long Sleeved,더블유 브이 프로젝트 후드 집 업 크림 집 업 후드 후드 집 업 후드 티 
791,스파오(SPAO) 루즈핏 후드집업_SPMZB49G02,https://store.musinsa.com/app/goods/2045870,top,hood zip up,spring,casual,여,후드 후드집업 루즈핏 루즈핏후드,Female Long Sleeved,스파 오 후드 집 업 후드 후드 집 업 
792,제멋(JEMUT) 하이 양기모 후드 집업 블랙(HJHD2082),https://store.musinsa.com/app/goods/630257,top,hood zip up,spring,casual,남,기모 양기모후드 양털기모 집업 후드 후드집업 후드티,Furry Long Sleeved,제멋 하이 기모 후드 집 업 블랙 기모 기모 후드 양털 기모 집 업 후드 후드 집 업 후드 티 
793,무신사 스탠다드(MUSINSA STANDARD) 후디드 스웨트 집업_짧은 길이 [블랙],https://store.musinsa.com/app/goods/1213654,top,hood zip up,spring,casual,남,베이직 스웨트셋업 스웨트컬렉션 이지웨어 집업재킷 트레이닝복 단독후디 한정후드 단독 홈웨어컬렉션,Female Furry Jackets Long Sleeved Turtlenecks,신사 후디 드 스웨 집 업 길 블랙 베이직 이지 웨어 집 업 재킷 트레이닝복 단독 후디 한정 후드 단독 홈 웨어 컬렉션 
794,콜릿(KOLEAT) WOMEN 크롭 투웨이 후드집업 [GRAY] 트레이닝 맨투맨 츄리닝 ver.,https://store.musinsa.com/app/goods/2379190,top,hood zip up,spring,casual,여,후드집업 후드티 크롭후드티 기모후드티 츄리닝 트레이닝팬츠 크롭,Female Furry Long Sleeved,투 웨이 후드 집 업 트레이닝 맨투맨 츄리닝 후드 집 업 후드 티 기모 후드 티 츄리닝 트레이닝 팬츠 
795,소버먼트(SOVERMENT) 980g pigment CUT hoody zip up-chacoal-,https://store.musinsa.com/app/goods/2105470,top,hood zip up,spring,casual,남,집업 후드티 후드집업 후디집업 스웨트셋업 피그먼트 셋업,Long Sleeved,버먼 집 업 후드 티 후드 집 업 후디 집 업 피 셋업 
796,트래블(TRAVEL) [SET]트래블러 피그먼트 트레이닝 셋업 블랙 차콜,https://store.musinsa.com/app/goods/1537506,top,hood zip up,spring,casual,공용,세트 셋업 조거팬츠 트래블셋업 트레이닝 후드집업,Female Long Sleeved,트래블 트래블러 피 트레이닝 셋 업 블랙 차 콜 세트 셋업 조거 팬츠 트래블 셋업 트레이닝 후드 집 업 
797,미니멀프로젝트(MINIMALPROJECT) 피치스킨 오버핏 후드집업 MZT101 [MELANGE],https://store.musinsa.com/app/goods/1100204,top,hood zip up,spring,casual,남,오버사이즈후드집업 기모후드집업 양기모 오버사이즈 무지후드티 무지후드집업 루즈핏후드집업,Female Furry Long Sleeved,미니 멀 프로젝트 피치 스킨 후드 집 업 101 오버 사이즈 후드 집 업 기모 후드 집 업 기모 오버 사이즈 무지 후드 티 무지 후드 집 업 
798,무신사 스탠다드(MUSINSA STANDARD) 후디드 스웨트 집업 [멜란지 라이트 그레이],https://store.musinsa.com/app/goods/1803535,top,hood zip up,spring,casual,남,후드집업 트레이닝복 스웨트컬렉션 맨투맨 이지웨어 라운지웨어,Female Long Sleeved,신사 후디 드 스웨 집 업 멜란지 라이트 그레이 후드 집 업 트레이닝복 맨투맨 이지 웨어 라운지 웨어 
799,이퓨원트(IFYOUWANT) 2 WAY CROP HOOD ZIPUP whitegray,https://store.musinsa.com/app/goods/2510119,top,hood zip up,spring,casual,여,셋업 원마일웨어 크롭후드 Y2K 후드셋업,Blouses Female Long Sleeved Round Neck,셋업 원 마일 웨어 Y2K 후드 셋업 
800,아메스 월드와이드(AMES-WORLDWIDE) [WOODZ X AMES]AMES IN THE WOODZ FULL ZIP HOODIE_GY,https://store.musinsa.com/app/goods/2459547,top,hood zip up,spring,casual,남,집업 집업후드 후드집업 후디 후드 우즈 콜라보,,아메스 월드 이드 집 업 집 업 후드 후드 집 업 후디 후드 우즈 콜 라보 
801,무신사 스탠다드(MUSINSA STANDARD) 우먼즈 크롭 후디드 스웨트 집업 [블랙],https://store.musinsa.com/app/goods/1324101,top,hood zip up,spring,casual,여,무신사스탠다드우먼즈 우먼즈스웨트컬렉션 우먼즈아우터 스웨트컬렉션 스웻집업 이지웨어,Female Furry Long Sleeved,신사 후디 드 스웨 집 업 이지 웨어 
802,무신사 스탠다드(MUSINSA STANDARD) 기모 후디드 스웨트 집업 [미디엄 그레이],https://store.musinsa.com/app/goods/1629074,top,hood zip up,spring,casual,남,맨투맨 브러쉬 스웻 긴팔티 내핑 후드 스웨트컬렉션 가을아우터 베이식,Female Long Sleeved,신사 기모 후디 드 스웨 집 업 미디엄 그레이 맨투맨 긴팔 티 내 핑 후드 가을 아우 터 베이식 
803,무신사 스탠다드(MUSINSA STANDARD) 우먼즈 후디드 스웨트 집업 [블랙],https://store.musinsa.com/app/goods/2126172,top,hood zip up,spring,casual,여,이지웨어 라운지웨어 환절기아우터 스웨트컬렉션 우먼즈스웨트컬렉션 무신사스탠다드우먼즈 우먼즈아우터 무탠픽업,Black Female Long Sleeved,신사 후디 드 스웨 집 업 블랙 이지 웨어 라운지 웨어 환절기 아우 터 무태 픽업 
804,키뮤어(KIIMUIR) [SET UP] 플라워 로고 투웨이 스트링 후드집업 셋업_그레이,https://store.musinsa.com/app/goods/2293909,top,hood zip up,spring,casual,공용,후드티 후드집업 트레이닝세트 오버핏 셋업 조거 베이식,Female Long Sleeved,플라워 로고 투 웨이 후드 집 업 셋업 그레이 후드 티 후드 집 업 트레이닝 세트 셋업 조거 베이식 
805,유니어패럴(UNI APPAREL) 베이직 쭈리 후드집업 그레이,https://store.musinsa.com/app/goods/323880,top,hood zip up,spring,casual,여,,Female Long Sleeved,유니 어패럴 베이직 후드 집 업 그레이 
806,이퓨원트(IFYOUWANT) 2 WAY CROP HOOD ZIPUP black,https://store.musinsa.com/app/goods/2510120,top,hood zip up,spring,casual,여,셋업 원마일웨어 크롭후드 Y2K 후드셋업,Faux Fur Female Furry Long Sleeved,셋업 원 마일 웨어 Y2K 후드 셋업 
807,꼼파뇨(CPGN STUDIO) Not Today 자수 후드 집업 그레이,https://store.musinsa.com/app/goods/2189915,top,hood zip up,spring,casual,남,후드집업 벌룬핏 오버핏 후드 그래픽 자수 21F/W컬렉션,Female,파 뇨 자수 후드 집 업 그레이 후드 집 업 후드 그래픽 자수 컬렉션 
808,우알롱(WOOALONG) Signature stitch hood zip-up - BLACK,https://store.musinsa.com/app/goods/2287463,top,hood zip up,spring,casual,공용,후드티셔츠 후드티 집업 후드집업 우알롱후드 셋업 후드,Female Hoodies & Sweatshirts Long Sleeved,후드 티셔츠 후드 티 집 업 후드 집 업 셋업 후드 
809,비터셀즈(BITTERCELLS) 베이직 후드 집 업 & 베이직 조거 팬츠 셋 업,https://store.musinsa.com/app/goods/2127572,top,hood zip up,spring,casual,여,셋업 후드집업 트레이닝세트 트레이닝팬츠 트레이닝복 조거팬츠 후드,Female,베이직 후드 집 업 베이직 조거 팬츠 업 셋업 후드 집 업 트레이닝 세트 트레이닝 팬츠 트레이닝복 조거 팬츠 후드 
810,드로우핏(DRAW FIT) 오버사이즈 울 트렌치 코트 [BEIGE],https://store.musinsa.com/app/goods/709189,top,coat,winter,formal,남,오버사이즈트렌치코트 오버핏트렌치코트 코트 트렌치 트렌치코트 남자트렌치코트 오버핏,Female Long Sleeved,오버 사이즈 트렌치 코트 오버 사이즈 트렌치코트 코트 트렌치 트렌치코트 남자 트렌치코트 
811,드로우핏(DRAW FIT) 오버사이즈 울 트렌치 코트 [BLACK],https://store.musinsa.com/app/goods/709188,top,coat,winter,formal,남,오버사이즈트렌치코트 오버핏트렌치코트 트렌치 트렌치코트 간절기코트,Female Long Sleeved V-Necks,오버 사이즈 트렌치 코트 오버 사이즈 트렌치코트 트렌치 트렌치코트 간 절기 코트 
812,플레어업(FLAREUP) 오버사이즈 트렌치코트 (FL-012),https://store.musinsa.com/app/goods/680961,top,coat,winter,formal,남,롱코트 코트 트렌치 오버핏 루즈핏 봄코트 가을코트,Female Long Sleeved,플레어 업 오버 사이즈 트렌치코트 코트 트렌치 봄 코트 가을 코트 
813,쿠어(COOR) 울 트렌치 코트 (베이지),https://store.musinsa.com/app/goods/722581,top,coat,winter,formal,공용,맥시코트 오버사이즈트렌치코트 울트렌치코트 트렌치코트 트렌치 쿠어코트컬렉션,Female Long Sleeved,쿠어 트렌치 코트 베이지 맥 시 코트 오버 사이즈 트렌치코트 트렌치코트 트렌치코트 트렌치 쿠어 코트 컬렉션 
814,아치더(ARCHTHE) Single Cotton Trench Coat,https://store.musinsa.com/app/goods/2535505,top,coat,winter,formal,여,코트 트렌치 간절기코트 트렌치코트,Female Long Sleeved,아치 더 코트 트렌치 간 절기 코트 트렌치코트 
815,파르티멘토(PARTIMENTO) [블랙 워치] M-51 피시테일 코트,https://store.musinsa.com/app/goods/1787989,top,coat,winter,formal,남,블랙와치 오버사이즈 오버핏 M51 롱야상 피쉬테일 야상,Long Sleeved,파 르 티 멘 토 블랙 워치 피시 테이 코트 블랙 오버 사이즈 M51 피 테 야 
816,바이진저(BY GINGER) 커브드 더블브레스트 롱 코트 - 블랙,https://store.musinsa.com/app/goods/2516517,top,coat,winter,formal,여,,Female Long Sleeved V-Necks,바 이진 저 커브 드 더블 브레스트 코트 블랙 
817,바이진저(BY GINGER) 커브드 더블브레스트 롱 코트 - 오트밀,https://store.musinsa.com/app/goods/2516620,top,coat,winter,formal,여,,Female Long Sleeved,바 이진 저 커브 드 더블 브레스트 코트 오트밀 
818,모디파이드(MODIFIED) M1509 오버핏 베이지 맥코트,https://store.musinsa.com/app/goods/715124,top,coat,winter,formal,남,맥코트 봄코트 오버핏트렌치코트 트렌치 트렌치코트 오버핏 간절기아우터,Female,모디파이 드 베이지 맥 코트 맥 코트 봄 코트 트렌치 트렌치코트 간 절기 아우 터 
819,굿라이프웍스(GLW) 실켓 프리미엄 오버핏 트렌치코트 블랙,https://store.musinsa.com/app/goods/2092842,top,coat,winter,formal,남,오버핏코트 오버핏트렌치코트 트렌치코트 발마칸코트 봄코트 싱글코트 코트,Female Furry Long Sleeved,프리미엄 트렌치코트 트렌치코트 발마 칸 코트 봄 코트 싱글 코트 코트 
820,인사일런스(IN SILENCE) 오버사이즈 트렌치 코트 BLACK,https://store.musinsa.com/app/goods/1269066,top,coat,winter,formal,남,가을아우터 인사일런스트렌치코트 트렌치코트 프리오더 오버핏 트렌치 NEWAPPAREL,Female Long Sleeved,인 사일런스 오버 사이즈 트렌치 코트 가을 아우 터 인 사일런스 트렌치코트 트렌치코트 프리 오 트렌치 
821,쟈니웨스트(JHONNY WEST) Ponte Single Coat LD (Black),https://store.musinsa.com/app/goods/118769,top,coat,winter,formal,남,맥코트 무신사단독 분또 블랙 오버사이즈코트 오버핏 코트,Long Sleeved Wool,맥 코트 신사 단독 분 블랙 오버 사이즈 코트 코트 
822,드로우핏(DRAW FIT) 오버사이즈 울 트렌치 코트 [GREYISH BEIGE],https://store.musinsa.com/app/goods/1758438,top,coat,winter,formal,남,트렌치코트 트렌치 코트 오버핏코트 미니멀 오버핏트렌치,Long Sleeved Male,오버 사이즈 트렌치 코트 트렌치코트 트렌치 코트 미니 멀 
823,에디션(EDITION) 세미 오버핏 라글란 맥 코트_NNC1CG1991DNV,https://store.musinsa.com/app/goods/2507694,top,coat,winter,formal,남,트렌치 남성코트 아우터 맥코트 데일리룩 코트컬렉션,Female Long Sleeved Round Neck,에디션 세미 라 글 맥 코트 트렌치 남성 코트 아우 터 맥 코트 데일리 룩 코트 컬렉션 
824,마인드브릿지(MINDBRIDGE) [SMART][COUTURE]더블트렌치코트 MWCA2101,https://store.musinsa.com/app/goods/2299698,top,coat,winter,formal,남,코트 트렌치코트 롱코트 봄코트 가을코트 남자트렌치코트 버버리코트 22S/S신상품 스마트라인,Long Sleeved Male,더블 트렌치코트 코트 트렌치코트 봄 코트 가을 코트 남자 트렌치코트 버버리 코트 신상품 스마트 라인 
825,무신사 스탠다드(MUSINSA STANDARD) 코튼 오버사이즈 맥 코트 [블랙],https://store.musinsa.com/app/goods/1295729,top,coat,winter,formal,남,롱코트 루즈핏코트 싱글코트 오버핏코트 캐주얼 가을아우터 오버핏 맥코트 코트컬렉션 무탠픽업,Collared Long Sleeved Male,신사 코트 오버 사이즈 맥 코트 싱글 코트 캐주얼 가을 아우 터 맥 코트 코트 컬렉션 무태 픽업 
826,라퍼지 포 우먼(LAFUDGE FOR WOMAN) [Woman]포플린 코튼 와이드 칼라 맥코트_Begie,https://store.musinsa.com/app/goods/2345907,top,coat,winter,formal,여,롱코트 코트 맥코트 싱글코트 봄코트 트렌치코트 면코트,Female Long Sleeved,라 퍼지 포 우먼 포플린 코트 와이드 칼라 코트 맥 코트 싱글 코트 봄 코트 트렌치코트 면 코트 
827,구아(GOOA) DUKE TRENCH COAT [BLACK],https://store.musinsa.com/app/goods/2532872,top,coat,winter,formal,남,맥코트 코트 트렌치 간절기아우터 간절기코트,Female Long Sleeved,아 맥 코트 코트 트렌치 간 절기 아우 터 간 절기 코트 
828,구아(GOOA) DUKE TRENCH COAT [IVORY],https://store.musinsa.com/app/goods/2532880,top,coat,winter,formal,남,맥코트 트렌치 코트 간절기아우터 간절기코트,Female Long Sleeved,아 맥 코트 트렌치 코트 간 절기 아우 터 간 절기 코트 
829,무신사 스탠다드(MUSINSA STANDARD) 코튼 오버사이즈 맥 코트 [베이지],https://store.musinsa.com/app/goods/1295730,top,coat,winter,formal,남,롱코트 루즈핏코트 싱글코트 오버핏코트 캐주얼 가을아우터 오버핏 맥코트 코트컬렉션 무탠픽업,Female Long Sleeved,신사 코트 오버 사이즈 맥 코트 싱글 코트 캐주얼 가을 아우 터 맥 코트 코트 컬렉션 무태 픽업 
830,스파오(SPAO) 오버핏 발마칸 코트_SPJWB4VM13,https://store.musinsa.com/app/goods/2206699,top,coat,winter,formal,남,발마칸코트 발마칸 오버핏 오버핏코트 겨울코트,Female Jackets Long Sleeved,스파 오 발 마카 코트 발마 칸 코트 발 마카 겨울 코트 
831,커스텀어클락(COSTUME O’CLOCK) 에센셜 오버핏 더블 브레스티드 코트 블랙,https://store.musinsa.com/app/goods/1792939,top,coat,winter,formal,남,21세컨모놀로그 더블코트 오버사이즈 간절기코트 롱코트 데일리 오버핏,Female Long Sleeved,에센셜 더블 브레스 티 드 코트 블랙 세 모노 로그 더블 코트 오버 사이즈 간 절기 코트 데일리 
832,굿라이프웍스(GLW) 실켓 프리미엄 오버핏 트렌치코트 베이지,https://store.musinsa.com/app/goods/2092839,top,coat,winter,formal,남,롱코트 오버핏트렌치코트 간절기아우터 간절기코트 트렌치코트 봄코트 봄아우터,Female Furry Long Sleeved,프리미엄 트렌치코트 간 절기 아우 터 간 절기 코트 트렌치코트 봄 코트 봄 아우 터 
833,드로우핏(DRAW FIT) 오버사이즈 울 트렌치 코트 [DUSTY CREAM],https://store.musinsa.com/app/goods/1288200,top,coat,winter,formal,남,오버사이즈트렌치 오버핏트렌치 오버핏트렌치코트 코트 트렌치코트 트렌치 오버핏,Female Long Sleeved,오버 사이즈 트렌치 코트 오버 사이즈 트렌치 코트 트렌치코트 트렌치 
834,드로우핏(DRAW FIT) 오버사이즈 울 트렌치 코트 [CHARCOAL],https://store.musinsa.com/app/goods/1120476,top,coat,winter,formal,남,트렌치 트렌치코트 남자트렌치코트 간절기코트 오버핏트렌치코트 코트,Long Sleeved,오버 사이즈 트렌치 코트 트렌치 트렌치코트 남자 트렌치코트 간 절기 코트 코트 
835,리버클래시(LIBERCLASSY) 2022 SS LIS20814 SEMIOVERFIT,https://store.musinsa.com/app/goods/2493575,top,coat,winter,formal,남,,Female Long Sleeved,리버 클래시 
836,리버클래시(LIBERCLASSY) 2022 SS LIS20815 SEMIOVERFIT,https://store.musinsa.com/app/goods/2493577,top,coat,winter,formal,남,,Female Long Sleeved,리버 클래시 
837,리버클래시(LIBERCLASSY) 2022 SS LIS20808 OVERFIT,https://store.musinsa.com/app/goods/2493546,top,coat,winter,formal,남,,Chiffon Female,리버 클래시 
838,리버클래시(LIBERCLASSY) 2022 SS LIS20807 OVERFIT,https://store.musinsa.com/app/goods/2493574,top,coat,winter,formal,남,,Female Long Sleeved,리버 클래시 
839,에디션(EDITION) 세미 오버핏 라글란 맥 코트_NNC1CG1991LBE,https://store.musinsa.com/app/goods/2507700,top,coat,winter,formal,남,트렌치 간절기아우터 아우터 맥코트 베이지코트 코트추천 데일리룩,Female Long Sleeved,에디션 세미 라 글 맥 코트 트렌치 간 절기 아우 터 아우 터 맥 코트 베이지 코트 코트 추천 데일리 룩 
840,버버리(BURBERRY) 여성 숏 이슬링턴 트렌치 코트 - 허니 / 8027947,https://store.musinsa.com/app/goods/2381934,top,coat,winter,formal,남,무신사부티크 럭셔리 트렌치 코트,Female Long Sleeved,버버리 여성 숏 이슬 링 트렌치 코트 허니 무신 사부 티크 트렌치 코트 
841,버버리(BURBERRY) 여성 미드 렝스 켄싱턴 헤리티지 트렌지 코트 - 블랙 / 8045783,https://store.musinsa.com/app/goods/2381936,top,coat,winter,formal,남,무신사부티크 럭셔리 헤리티지 트렌지 코트,Female Long Sleeved,버버리 여성 미드 켄 싱 터 헤리티지 트레 코트 블랙 무신 사부 티크 헤리티지 트레 코트 
842,닉앤니콜(NICK&NICOLE) 오버사이즈 더블 트렌치 코트_블랙,https://store.musinsa.com/app/goods/2110658,top,coat,winter,formal,여,간절기아우터 롱코트 가을아우터 싱글코트 트렌치코트 오버핏코트 가을코트,Female Furry Long Sleeved,닉 앤 니콜 오버 사이즈 더블 트렌치 코트 블랙 간 절기 아우 터 가을 아우 터 싱글 코트 트렌치코트 가을 코트 
843,디센디스(DISENDIS) Cutting Single Trench Coat (Beige),https://store.musinsa.com/app/goods/2526723,top,coat,winter,formal,여,맥코트 코트 럭셔리 간절기코트 간절기아우터,Female Long Sleeved Round Neck Short Sleeves,디 센 디스 맥 코트 코트 간 절기 코트 간 절기 아우 터 
844,디센디스(DISENDIS) Cutting Single Trench Coat (Navy),https://store.musinsa.com/app/goods/2526656,top,coat,winter,formal,여,트렌치 럭셔리 코트 간절기아우터 간절기코트 맥코트,Female Furry Long Sleeved,디 센 디스 트렌치 코트 간 절기 아우 터 간 절기 코트 맥 코트 
845,닉앤니콜(NICK&NICOLE) 오버사이즈 더블 트렌치 코트_그레이,https://store.musinsa.com/app/goods/2110734,top,coat,winter,formal,여,트렌치코트 오버사이즈 오버핏트렌치코트 롱코트 가을아우터 가을코트 트렌치,Female Long Sleeved,닉 앤 니콜 오버 사이즈 더블 트렌치 코트 그레이 트렌치코트 오버 사이즈 가을 아우 터 가을 코트 트렌치 
846,오프닝선샤인(OPENING SUNSHINE) 볼륨슬리브 코팅 트렌치코트 베이지,https://store.musinsa.com/app/goods/2490110,top,coat,winter,formal,여,트렌치코트 맥코트 22S/S신상품 간절기아우터 트랜치코트 봄아우터,Female Long Sleeved Round Neck,오프닝 선샤인 코팅 트렌치코트 베이지 트렌치코트 맥 코트 신상품 간 절기 아우 터 치 코트 봄 아우 터 
847,클라이드앤(CLRIDEN) 여성 더블 숏 자켓 다크베이지 FMBJK761FDBE,https://store.musinsa.com/app/goods/2487910,top,coat,winter,formal,여,자켓 숏자켓 봄자켓 봄아우터 22S/S신상품 간절기아우터,Female Long Sleeved,라이드 앤 여성 더블 숏 다크 베이지 봄 아우 터 신상품 간 절기 아우 터 
848,오프닝선샤인(OPENING SUNSHINE) 볼륨 슬리브 코팅 트렌치코트 카키,https://store.musinsa.com/app/goods/2490103,top,coat,winter,formal,여,22S/S신상품 트렌치코트 봄아우터 봄트렌치코트 맥코트 간절기아우터,Female Long Sleeved,오프닝 선샤인 볼륨 코팅 트렌치코트 카키 신상품 트렌치코트 봄 아우 터 봄 트렌치코트 맥 코트 간 절기 아우 터 
849,클라이드앤(CLRIDEN) 여성 더블 숏 자켓 라이트베이지 FMBJK761FLBE,https://store.musinsa.com/app/goods/2487911,top,coat,winter,formal,여,재킷 숏자켓 22S/S신상품 아우터 봄자켓 봄아우터,Female,라이드 앤 여성 더블 숏 라이트 베이지 재킷 신상품 아우 터 봄 아우 터 
850,드로우핏(DRAW FIT) 오버사이즈 울 트렌치 코트 [GREIGE],https://store.musinsa.com/app/goods/2041548,top,coat,winter,formal,남,코트 트렌치코트 간절기코트 가을코트 간절기아우터 트렌치,Female Long Sleeved,오버 사이즈 트렌치 코트 코트 트렌치코트 간 절기 코트 가을 코트 간 절기 아우 터 트렌치 
851,티(T) HOODIE DETACHABLE MAC COAT (IVORY) ZACS3-MCL010_130,https://store.musinsa.com/app/goods/2511405,top,coat,winter,formal,남,,Female Long Sleeved,티 
852,컴젠(COMGEN) 블랙 윈도우 체크 카코트 BLACK-CHECK NACS1-MCL030_452,https://store.musinsa.com/app/goods/2517438,top,coat,winter,formal,남,,Female Long Sleeved Round Neck,컴 젠 블랙 윈도우 체크 카 코트 
853,컴젠(COMGEN) 페이드 민트 오버사이즈 발마칸 코트 MINT NACU4-MCL020_240,https://store.musinsa.com/app/goods/2517963,top,coat,winter,formal,남,,Female Long Sleeved Round Neck,컴 젠 페이 드 민트 오버 사이즈 발 마카 코트 
854,비지트인뉴욕(VISITINNEWYORK) 레터링 임브로이더드 트렌치재킷(VW3BBA2),https://store.musinsa.com/app/goods/2485758,top,coat,winter,formal,여,비지트인뉴욕아우터,Female Long Sleeved,뉴욕 레터 링 임 브로 이 더 드 트렌치 재킷 비지 뉴욕 아우 터 
855,비지트인뉴욕(VISITINNEWYORK) 벨티드 숏 트렌치재킷(VW3BB92),https://store.musinsa.com/app/goods/2485747,top,coat,winter,formal,여,비지트인뉴욕아우터,Chiffon Female Long Sleeved,뉴욕 벨 티 드 숏 트렌치 재킷 비지 뉴욕 아우 터 
856,비지트인뉴욕(VISITINNEWYORK) 벨티드 트렌치 코트(VW3BB95),https://store.musinsa.com/app/goods/2485780,top,coat,winter,formal,여,비지트인뉴욕아우터,Female Long Sleeved Round Neck Short Sleeves,뉴욕 벨 티 드 트렌치 코트 비지 뉴욕 아우 터 
857,컴젠(COMGEN) 블랙 윈도우 체크 맥코트 BLACK-CHECK NACS1-WCL030_452,https://store.musinsa.com/app/goods/2515853,top,coat,winter,formal,여,,Female Long Sleeved,컴 젠 블랙 윈도우 체크 맥 코트 
