number,name,link,tob,cate,season,situation,gender,tag,attr,nouns
1655,무신사 스탠다드(MUSINSA STANDARD) 우먼즈 오버사이즈 블레이저 [그레이],https://store.musinsa.com/app/goods/1618309,top,suit,spring,office,여,무신사스탠다드우먼즈 우먼즈아우터 루즈핏 셋업 정장 테일러드재킷 환절기아우터 무탠픽업,Female Long Sleeved Suits & Blazers V-Necks Wool,신사 오버 사이즈 블레이저 셋업 정장 테일러 드 재킷 환절기 아우 터 무태 픽업 
1656,수아레(SUARE) 린넨 라이크 셋업 수트 블랙,https://store.musinsa.com/app/goods/1857629,top,suit,spring,office,남,린넨 린넨자켓 자켓 블레이저 오버핏 셋업 수트,Long Sleeved Male,수 아 레 린네 라이 셋업 수트 블랙 린네 블레이저 셋업 수트 
1657,무신사 스탠다드(MUSINSA STANDARD) 릴렉스드 베이식 블레이저 [다크 그레이],https://store.musinsa.com/app/goods/1895220,top,suit,spring,office,남,수트 정장 자켓 셋업 테일러드재킷 투버튼 블레이저 퍼펙트블레이저,Long Sleeved Suits & Blazers V-Necks,신사 릴 렉스 드 베이식 블레이저 다크 그레이 수트 정장 셋업 테일러 드 재킷 투 버튼 블레이저 퍼펙트 블레이저 
1658,더니트컴퍼니(THEKNITCOMPANY) [SET] 22SS 쿨맥스 위버쿨 자켓 & 쿨맥스 슬림핏 슬랙스,https://store.musinsa.com/app/goods/2499213,top,suit,spring,office,남,,Female Long Sleeved,더 니트 컴퍼니 SS 위버 쿠 
1659,수아레(SUARE) 하운드 체크 셋업 수트,https://store.musinsa.com/app/goods/1583459,top,suit,spring,office,남,셋업 자켓 아우터 체크자켓 블레이저 체크 하운드,Female Long Sleeved,수 아 레 하운드 체크 셋업 수트 셋업 아우 터 블레이저 체크 하운드 
1660,더니트컴퍼니(THEKNITCOMPANY) [SET] 22SS 쿨맥스 위버쿨 자켓 & 쿨맥스 세미와이드핏 슬랙스,https://store.musinsa.com/app/goods/2498225,top,suit,spring,office,남,셋업코디 셋업 세트 블레이져 봄아우터 싱글자켓 셋업자켓,Female Long Sleeved,더 니트 컴퍼니 SS 위버 쿠 셋업 세트 봄 아우 터 
1661,시그니처(SIGNATURE) 썸머 오버핏 블레이저 자켓[블랙],https://store.musinsa.com/app/goods/1050866,top,suit,spring,office,남,블레이저 블레이져 셋업 오버핏 정장자켓 정장재킷,Female Long Sleeved,시 그니 처 블레이저 셋업 정장 재킷 
1662,무신사 스탠다드(MUSINSA STANDARD) 우먼즈 오버사이즈 블레이저 [더스티 베이지],https://store.musinsa.com/app/goods/1797622,top,suit,spring,office,여,무신사스탠다드우먼즈 루즈핏 셋업 정장 테일러드재킷 환절기아우터 우먼즈아우터,Female Furry Long Sleeved Trench Coats V-Necks Wool,신사 오버 사이즈 블레이저 더 스티 셋업 정장 테일러 드 재킷 환절기 아우 터 
1663,무신사 스탠다드(MUSINSA STANDARD) 우먼즈 플루이드 블레이저 [베이지],https://store.musinsa.com/app/goods/1343225,top,suit,spring,office,여,무신사스탠다드우먼즈 셋업 테일러드재킷 우먼즈아우터 퍼펙트블레이저 싱글자켓 블레이저 무탠픽업,Blouses Chiffon Female Long Sleeved Peplum,신사 루이 드 블레이저 셋업 테일러 드 재킷 퍼펙트 블레이저 블레이저 무태 픽업 
1664,모노소잉(MONOSEWING) 울 셋업 블레이저(블랙),https://store.musinsa.com/app/goods/727887,top,suit,spring,office,남,싱글자켓 셋업 정장자켓 블레이저 재킷 블레이져 울자켓,Long Sleeved Male,모노 소 셋업 셋업 블레이저 재킷 
1665,무신사 스탠다드(MUSINSA STANDARD) 우먼즈 라이트웨이트 오버사이즈 블레이저 [블랙],https://store.musinsa.com/app/goods/2398619,top,suit,spring,office,여,정장 오버핏 기본재킷 환절기아우터 블레이저 퍼펙트블레이저 무신사스탠다드우먼즈 우먼즈아우터,Female Furry Long Sleeved Peacoats Suits & Blazers V-Necks Wool,신사 라이트 웨이트 오버 사이즈 블레이저 블랙 정장 기본 재킷 환절기 아우 터 블레이저 퍼펙트 블레이저 
1666,무신사 스탠다드(MUSINSA STANDARD) 오버사이즈 더블 브레스티드 블레이저 [블랙],https://store.musinsa.com/app/goods/1595830,top,suit,spring,office,남,정장 셋업 블레이저 퍼펙트블레이저 재킷 더블재킷 오버핏 환절기아우터,Long Sleeved,신사 오버 사이즈 더블 브레스 티 드 블레이저 블랙 정장 셋업 블레이저 퍼펙트 블레이저 재킷 더블 재킷 환절기 아우 터 
1667,무신사 스탠다드(MUSINSA STANDARD) [쿨탠다드] 릴렉스드 베이식 블레이저 [네이비],https://store.musinsa.com/app/goods/2444809,top,suit,spring,office,남,쿨탠다드 정장 기본재킷 환절기아우터 블레이저 기능성 퍼펙트블레이저,Long Sleeved Male Peacoats Suits & Blazers V-Necks Wool,신사 쿠 태 다 드 릴 렉스 드 베이식 블레이저 이비 쿠 태 다 드 정장 기본 재킷 환절기 아우 터 블레이저 기능 퍼펙트 블레이저 
1668,수아레(SUARE) 하운드 체크 스위치 싱글 자켓,https://store.musinsa.com/app/goods/1551396,top,suit,spring,office,남,블레이저 셋업 수트 자켓 체크자켓 체크 싱글재킷,Long Sleeved,수 아 레 하운드 체크 스위치 싱글 셋업 수트 체크 싱글 재킷 
1669,인사일런스(IN SILENCE) [깡스타일리스트 콜라보] 디태처블 울 블레이저 BLACK,https://store.musinsa.com/app/goods/2365614,top,suit,spring,office,남,인사일런스×깡스타일리스트,Furry Long Sleeved Male,인 사일런스 깡 스타일 리스트 콜 라보 블레이저 사일런스 깡 스타일 리스트 
1670,무신사 스탠다드(MUSINSA STANDARD) 오버사이즈 3버튼 블레이저 [차콜 그레이],https://store.musinsa.com/app/goods/1558199,top,suit,spring,office,남,정장 셋업 블레이저 퍼펙트블레이저 재킷 오버핏 환절기아우터 무탠픽업,Long Sleeved Male V-Necks,신사 오버 사이즈 버튼 블레이저 차코 그레이 정장 셋업 블레이저 퍼펙트 블레이저 재킷 환절기 아우 터 무태 픽업 
1671,애드호크(ADHOC) 오버핏 싱글 자켓,https://store.musinsa.com/app/goods/2538960,top,suit,spring,office,남,블레이저 기본재킷 싱글자켓 자켓 오버핏 여름자켓 재킷,Long Sleeved Male,애드 호크 싱글 기본 재킷 재킷 
1672,에잇세컨즈(8SECONDS) 화섬 투버튼 싱글 재킷 (162511FY30),https://store.musinsa.com/app/goods/2540012,top,suit,spring,office,여,162511FY30,Female White,에잇세컨즈 화 섬 투 버튼 싱글 재킷 30 
1673,에잇세컨즈(8SECONDS) 리넨 트윌 반팔 싱글 재킷_셋업 (322411KY4L),https://store.musinsa.com/app/goods/2540035,top,suit,spring,office,여,322411KY4L,Long Sleeved,에잇세컨즈 리 반팔 싱글 재킷 셋업 
1674,무신사 스탠다드(MUSINSA STANDARD) 로 엣지 오버사이즈 블레이저 [블랙],https://store.musinsa.com/app/goods/2413618,top,suit,spring,office,남,오버핏 정장 기본재킷 환절기아우터 블레이저 퍼펙트블레이저,Long Sleeved Male V-Necks,신사 로 오버 사이즈 블레이저 정장 기본 재킷 환절기 아우 터 블레이저 퍼펙트 블레이저 
1675,무신사 스탠다드(MUSINSA STANDARD) [쿨탠다드] 우먼즈 베이식 블레이저 [블랙],https://store.musinsa.com/app/goods/2398618,top,suit,spring,office,여,쿨탠다드 무신사스탠다드우먼즈 정장 퍼펙트블레이저 기능성 환절기아우터 기본재킷,Black Female Long Sleeved Suits & Blazers V-Necks,신사 쿠 태 다 드 베이식 블레이저 블랙 쿠 태 다 드 정장 퍼펙트 블레이저 기능 환절기 아우 터 기본 재킷 
1676,언티지(UNTAGE) 하운드투스 체크 크롭 트위드 자켓(WOMAN)_UTO-FB09,https://store.musinsa.com/app/goods/2537554,top,suit,spring,office,여,재킷 아우터 자켓 트위드 트위드자켓 트위드셋업 블레이져,Female Long Sleeved Round Neck,언 티 지 체크 아우 터 
1677,에잇세컨즈(8SECONDS) 베이지 싱글 아웃포켓 반팔 숏재킷 (322511LY1A),https://store.musinsa.com/app/goods/2540033,top,suit,spring,office,여,322511LY1A,Female,에잇세컨즈 베이지 싱글 아웃 포켓 반팔 숏 재킷 
1678,에잇세컨즈(8SECONDS) 그레이 원버튼 반팔 싱글 재킷_셋업 (322411DY24),https://store.musinsa.com/app/goods/2540034,top,suit,spring,office,여,,Female Long Sleeved,에잇세컨즈 그레이 원 버튼 반팔 싱글 재킷 셋업 
1679,에잇세컨즈(8SECONDS) 멜란지 리넨 하프 슬리브 숏재킷_셋업 (322511FY1H),https://store.musinsa.com/app/goods/2540014,top,suit,spring,office,여,,,에잇세컨즈 멜란지 리 하프 숏 재킷 셋업 
1680,에잇세컨즈(8SECONDS) 베이지 리넨 트윌 스티치 하프 슬리브 숏재킷 (322511JY2A),https://store.musinsa.com/app/goods/2540030,top,suit,spring,office,여,322511JY2A,Female,에잇세컨즈 베이지 리 스티치 하프 숏 재킷 
1681,에잇세컨즈(8SECONDS) 서머 트위드 반팔 숏재킷 (322411LY72),https://store.musinsa.com/app/goods/2540020,top,suit,spring,office,여,,Female Long Sleeved Round Neck,에잇세컨즈 서머 반팔 숏 재킷 
1682,에잇세컨즈(8SECONDS) 화이트 싱글 아웃포켓 반팔 숏재킷 (322511LY11),https://store.musinsa.com/app/goods/2540031,top,suit,spring,office,여,322511LY11,Female,에잇세컨즈 화이트 싱글 아웃 포켓 반팔 숏 재킷 11 
1683,에잇세컨즈(8SECONDS) 블랙 원버튼 반팔 싱글 재킷_셋업 (322411DY25),https://store.musinsa.com/app/goods/2540009,top,suit,spring,office,여,,Female,에잇세컨즈 블랙 원 버튼 반팔 싱글 재킷 셋업 
1684,클라비스(CLOVIS) 린넨 반팔 자켓 (2colors) CVJKC2502N,https://store.musinsa.com/app/goods/2538770,top,suit,spring,office,여,,Long Sleeved,린네 반팔 
1685,무신사 스탠다드(MUSINSA STANDARD) 오버사이즈 크롭 블레이저 [블랙],https://store.musinsa.com/app/goods/2425220,top,suit,spring,office,남,오버핏 정장 기본재킷 환절기아우터 블레이저 퍼펙트블레이저,Long Sleeved Male Peacoats V-Necks,신사 오버 사이즈 블레이저 정장 기본 재킷 환절기 아우 터 블레이저 퍼펙트 블레이저 
1686,파르티멘토(PARTIMENTO) [리뉴얼] 리넨 블레이저 자켓 블랙,https://store.musinsa.com/app/goods/1934636,top,suit,spring,office,남,린넨 린넨자켓 여름자켓 블레이저 오버핏 자켓 셋업자켓,Long Sleeved,파 르 티 멘 토 리 뉴 얼 리 블레이저 블랙 린네 블레이저 
1687,무신사 스탠다드(MUSINSA STANDARD) 로 엣지 오버사이즈 블레이저 [차콜 그레이],https://store.musinsa.com/app/goods/2413619,top,suit,spring,office,남,오버핏 정장 기본재킷 환절기아우터 블레이저 퍼펙트블레이저,Furry Long Sleeved Peacoats Suits & Blazers V-Necks Wool,신사 로 오버 사이즈 블레이저 차코 정장 기본 재킷 환절기 아우 터 블레이저 퍼펙트 블레이저 
1688,무신사 스탠다드(MUSINSA STANDARD) 베이식 울 블레이저 [미디엄 그레이],https://store.musinsa.com/app/goods/2113515,top,suit,spring,office,남,블레이저.재킷.테일러드재킷 셋업재킷 투버튼 울자켓 정장,Long Sleeved Male Peacoats Suits & Blazers Wool,신사 베이식 블레이저 미디엄 그레이 블레이저 재킷 테일러 드 재킷 셋업 재킷 투 버튼 정장 
1689,아치더(ARCHTHE) Single Button Linen Jacket,https://store.musinsa.com/app/goods/2535477,top,suit,spring,office,여,자켓 블레이져 린넨 싱글자켓,Female Long Sleeved,아치 더 린네 
1690,르니앤맥코이(LENIC&MCCOY) 롤업 배색 오픈 포켓 재킷 MJ05JK206HJJ,https://store.musinsa.com/app/goods/2535732,top,suit,spring,office,여,,Chiffon Female Long Sleeved,르 앤 맥 코 이 롤 업 배색 오픈 포켓 재킷 
1691,빈폴 멘(BEANPOLE MEN) 그레이 트리아세테이트 블렌드 재킷 (BC2211A523),https://store.musinsa.com/app/goods/2535003,top,suit,spring,office,남,BC2211A523,Female Long Sleeved,빈폴 멘 그레이 트리 아세테이트 재킷 523 
1692,무신사 스탠다드(MUSINSA STANDARD) 오버사이즈 크롭 블레이저 [그레이],https://store.musinsa.com/app/goods/2425221,top,suit,spring,office,남,오버핏 정장 기본재킷 환절기아우터 블레이저 퍼펙트블레이저,Long Sleeved Male,신사 오버 사이즈 블레이저 정장 기본 재킷 환절기 아우 터 블레이저 퍼펙트 블레이저 
1693,로파이(LOFI) 오버핏 3버튼 블레이져 (뉴트로 체크),https://store.musinsa.com/app/goods/938719,top,suit,spring,office,남,블레이저 셋업 오버핏 자켓 정장자켓 블레이져,Female Furry Long Sleeved V-Necks,로 파이 버튼 뉴트 체크 블레이저 셋업 
1694,무신사 스탠다드(MUSINSA STANDARD) [쿨탠다드] 릴렉스드 베이식 블레이저 [라이트 베이지],https://store.musinsa.com/app/goods/2444811,top,suit,spring,office,남,쿨탠다드 정장 기본재킷 환절기아우터 블레이저 기능성 퍼펙트블레이저,Female Long Sleeved V-Necks,신사 쿠 태 다 드 릴 렉스 드 베이식 블레이저 라이트 베이지 쿠 태 다 드 정장 기본 재킷 환절기 아우 터 블레이저 기능 퍼펙트 블레이저 
1695,에잇세컨즈(8SECONDS) 네이비 리넨 하프 슬리브 숏재킷 (162511FY2R),https://store.musinsa.com/app/goods/2540027,top,suit,spring,office,여,,Long Sleeved Male,에잇세컨즈 이비 리 하프 숏 재킷 
1696,파르티멘토(PARTIMENTO) [리뉴얼][세트] 리넨 블레이저 자켓 셋업 베이지,https://store.musinsa.com/app/goods/1435187,top,suit,spring,office,남,린넨 반바지 블레이저 셋업 패키지 연말빅세일,Female Long Sleeved Round Neck,파 르 티 멘 토 리 뉴 얼 세트 리 블레이저 셋업 베이지 린네 반바지 블레이저 셋업 패키지 연말 빅 세일 
1697,무신사 스탠다드(MUSINSA STANDARD) 우먼즈 오버사이즈 블레이저 [차콜 그레이],https://store.musinsa.com/app/goods/1797621,top,suit,spring,office,여,무신사스탠다드우먼즈 루즈핏 셋업 정장 테일러드재킷 환절기아우터 우먼즈아우터 무탠픽업,Female Furry Long Sleeved Wool,신사 오버 사이즈 블레이저 차코 셋업 정장 테일러 드 재킷 환절기 아우 터 무태 픽업 
1698,그리디어스(GREEDILOUS) 자카드 원 버튼 자켓,https://store.musinsa.com/app/goods/2530770,top,suit,spring,office,여,,Female Long Sleeved,리 디 어스 자 카드 원 버튼 
1699,그리디어스(GREEDILOUS) 다이아 체크 도트 싱글 버튼 자켓,https://store.musinsa.com/app/goods/2530955,top,suit,spring,office,여,,Female Long Sleeved,리 디 어스 다이아 체크 도 싱글 버튼 
1700,그리디어스(GREEDILOUS) 오션 펄 프린트 자켓,https://store.musinsa.com/app/goods/2530464,top,suit,spring,office,여,자켓,Female Round Neck,리 디 어스 오션 펄 프린트 
1701,그리디어스(GREEDILOUS) 트위드 숏 슬리브 자켓,https://store.musinsa.com/app/goods/2531789,top,suit,spring,office,여,,Bodycon Dresses Female Long Sleeved Round Neck,리 디 어스 숏 
1702,그리디어스(GREEDILOUS) 크롭 자켓,https://store.musinsa.com/app/goods/2530977,top,suit,spring,office,여,,Female,리 디 어스 
1703,그리디어스(GREEDILOUS) 심플 원 버튼 자켓,https://store.musinsa.com/app/goods/2530806,top,suit,spring,office,여,,Female Long Sleeved V-Necks,리 디 어스 심플 원 버튼 
1704,그리디어스(GREEDILOUS) 오션 체크 프린트 자켓,https://store.musinsa.com/app/goods/2530960,top,suit,spring,office,여,,Female Long Sleeved,리 디 어스 오션 체크 프린트 
1705,그리디어스(GREEDILOUS) 솔리드 오션 펄 프린트 콤비 자켓,https://store.musinsa.com/app/goods/2530600,top,suit,spring,office,여,,Female Long Sleeved,리 디 어스 솔리드 오션 펄 프린트 콤비 
1706,그리디어스(GREEDILOUS) 스팽글 더블 브리스티드 자켓,https://store.musinsa.com/app/goods/2530978,top,suit,spring,office,여,,Female Round Neck,리 디 어스 더블 브리 스티 드 
1707,그리디어스(GREEDILOUS) 타이다이 프린트 자켓,https://store.musinsa.com/app/goods/2530817,top,suit,spring,office,여,,Dresses Female Long Sleeved,리 디 어스 타이 다이 프린트 
1708,그리디어스(GREEDILOUS) 오션 체크 프린트 크롭 자켓,https://store.musinsa.com/app/goods/2530967,top,suit,spring,office,여,,Female Long Sleeved Round Neck,리 디 어스 오션 체크 프린트 
1709,그리디어스(GREEDILOUS) 씨 아네모네 올오버 투 버튼 자켓,https://store.musinsa.com/app/goods/2530656,top,suit,spring,office,여,,Female Long Sleeved,리 디 어스 씨 아네모네 오버 투 버튼 
1710,예일(YALE) WARM UP QUILTING JACKET BLACK,https://store.musinsa.com/app/goods/2135207,top,short padding,winter,casual,남,자켓 패딩점퍼 경량패딩 숏패딩 남성패딩 경량다운 로고 아이비리그 퀼팅,Female Long Sleeved Round Neck,예일 패딩 점퍼 경량 패딩 숏 패딩 남성 패딩 경량 다운 로고 아이비리그 
1711,라퍼지스토어(LAFUDGESTORE) [무봉제]덕다운 심리스 미니멀 푸퍼 숏패딩_Gray,https://store.musinsa.com/app/goods/1173385,top,short padding,winter,casual,공용,파카 패딩 숏패딩 오리털 푸퍼 다운,Long Sleeved,라 퍼지 스토어 봉 덕 다운 심 리스 미니 멀 숏 패딩 파카 패딩 숏 패딩 오리털 다운 
1712,스파오(SPAO) [허니푸퍼] 베이직 푸퍼_SPJPB4TC11,https://store.musinsa.com/app/goods/2037173,top,short padding,winter,casual,남,베이직푸퍼 푸퍼 여성숏패딩 남성숏패딩 패딩 허니푸퍼,Long Sleeved,스파 오 허니 베이직 베이직 여성 숏 패딩 남성 숏 패딩 패딩 허니 
1713,인사일런스(IN SILENCE) 에센셜 다운 자켓 GREY,https://store.musinsa.com/app/goods/656050,top,short padding,winter,casual,남,에센셜 프리오더 인사일런스점퍼 인사일런스다운자켓 다운점퍼 인사일런스다운점퍼 헤비아우터,Female Long Sleeved,인 사일런스 에센셜 다운 에센셜 프리 오 인 사일런스 점퍼 다운 점퍼 인 사일런스 다운 점퍼 헤비 아우 터 
1714,스파오(SPAO) [허니푸퍼] 리버서블 푸퍼_SPJDB4VC14,https://store.musinsa.com/app/goods/2037171,top,short padding,winter,casual,남,숏패딩 리버시블 리버시블패딩 패딩 허니푸퍼 후리스,Female Furry Long Sleeved,스파 오 허니 리버 서브 숏 패딩 리버 시브 리버 시브 패딩 패딩 허니 후 리스 
1715,무신사 스탠다드(MUSINSA STANDARD) 다운 푸퍼 숏 패딩 재킷 [라이트 그레이],https://store.musinsa.com/app/goods/912315,top,short padding,winter,casual,남,점퍼 오리털 오버핏 푸퍼 다운 숏다운 겨울아우터 셀럽아우터 헤비아우터컬렉션 무탠픽업,Female Long Sleeved,신사 다운 숏 패딩 재킷 라이트 그레이 점퍼 오리털 다운 숏 다운 겨울 아우 터 헤비 아우 터 컬렉션 무태 픽업 
1716,파르티멘토(PARTIMENTO) 3M 신슐레이트 보아 플리스 무톤 자켓 베이지,https://store.musinsa.com/app/goods/1690701,top,short padding,winter,casual,남,무스탕 양털 신슐레이트 숏패딩 후리스 오버핏패딩 연말빅세일,Female Long Sleeved,파 르 티 멘 토 3M 레이 리스 무토 베이지 무스탕 양털 레이 숏 패딩 후 리스 연말 빅 세일 
1717,스파오(SPAO) [허니푸퍼] 파스텔 푸퍼_SPJPB4TG01,https://store.musinsa.com/app/goods/2037167,top,short padding,winter,casual,여,패딩 여성숏패딩 코듀로이패딩 푸퍼 허니푸퍼,Female Furry Long Sleeved,스파 오 허니 파스텔 패딩 여성 숏 패딩 허니 
1718,노스페이스(THE NORTH FACE) NJ1DN55A 남성 1996 에코 눕시 자켓,https://store.musinsa.com/app/goods/2081554,top,short padding,winter,casual,남,남성바람막이 구스다운 아우터 다운점퍼 눕시컬렉션 숏패딩 에코컬렉션,Furry Jackets Leather,노스페이스 남성 에코 아우 터 다운 점퍼 컬렉션 숏 패딩 에코 컬렉션 
1719,내셔널지오그래픽(NATIONALGEOGRAPHIC) N204MDW930 타루가 남성 RDS 덕 다운 점퍼 CARBON BLACK,https://store.musinsa.com/app/goods/1515903,top,short padding,winter,casual,남,덕다운 숏패딩 아우터 점퍼 타루가 패딩 다운,Female Furry Long Sleeved,내셔널 지오 그래픽 타루 남성 덕 다운 점퍼 덕 다운 숏 패딩 아우 터 점퍼 타루 패딩 다운 
1720,라퍼지스토어(LAFUDGESTORE) [무봉제]덕다운 심리스 미니멀 푸퍼 숏패딩_Khaki,https://store.musinsa.com/app/goods/1173379,top,short padding,winter,casual,공용,덕다운 파카 패딩,Female Long Sleeved,라 퍼지 스토어 봉 덕 다운 심 리스 미니 멀 숏 패딩 덕 다운 파카 패딩 
1721,파르티멘토(PARTIMENTO) 3M 신슐레이트 푸퍼 패딩 자켓 그레이쉬 블루,https://store.musinsa.com/app/goods/1660617,top,short padding,winter,casual,남,패딩 헤비아우터 점퍼 다운점퍼 겨울아우터 숏패딩 신슐레이트,Long Sleeved,파 르 티 멘 토 3M 레이 패딩 그레이 블루 패딩 헤비 아우 터 점퍼 다운 점퍼 겨울 아우 터 숏 패딩 레이 
1722,예일(YALE) WARM UP QUILTING JACKET BEIGE,https://store.musinsa.com/app/goods/2135209,top,short padding,winter,casual,남,자켓 패딩점퍼 경량패딩 숏패딩 남성패딩 경량다운 로고 아이비리그,Female Long Sleeved,예일 패딩 점퍼 경량 패딩 숏 패딩 남성 패딩 경량 다운 로고 아이비리그 
1723,스파오(SPAO) [허니푸퍼] 코듀로이 푸퍼_SPJPB4TC17,https://store.musinsa.com/app/goods/2037172,top,short padding,winter,casual,남,남성숏패딩 코듀로이 코듀로이패딩점퍼 푸퍼 패딩 허니푸퍼,Female Furry Long Sleeved,스파 오 허니 남성 숏 패딩 패딩 허니 
1724,무신사 스탠다드(MUSINSA STANDARD) 다운 푸퍼 숏 패딩 재킷 [더스티 베이지],https://store.musinsa.com/app/goods/1152522,top,short padding,winter,casual,남,점퍼 오리털 오버핏 푸퍼 다운 숏다운 겨울아우터 헤비아우터컬렉션 무탠픽업,Female Long Sleeved,신사 다운 숏 패딩 재킷 더 스티 베이지 점퍼 오리털 다운 숏 다운 겨울 아우 터 헤비 아우 터 컬렉션 무태 픽업 
1725,세컨모놀로그(SECONDMONO) 컨템포러리 에어 포스 패딩 다크그레이,https://store.musinsa.com/app/goods/1194755,top,short padding,winter,casual,남,구스다운 숏패딩 에어포스 오리털점퍼 패딩 모놀로그컬렉션 21F/W컬렉션,Female Long Sleeved,세 모노 로그 템포 러 리 에어 포스 패딩 숏 패딩 에어포스 오리털 점퍼 패딩 모노 로그 컬렉션 컬렉션 
1726,라퍼지스토어(LAFUDGESTORE) [무봉제]덕다운 심리스 미니멀 푸퍼 숏패딩_Cream,https://store.musinsa.com/app/goods/1611979,top,short padding,winter,casual,공용,패딩 덕다운 오리털 숏패딩 푸퍼다운 파카,Female Long Sleeved,라 퍼지 스토어 봉 덕 다운 심 리스 미니 멀 숏 패딩 패딩 덕 다운 오리털 숏 패딩 파카 
1727,플랙(PLAC) 더블리스 리버시블 다운 점퍼 블랙,https://store.musinsa.com/app/goods/2032932,top,short padding,winter,casual,남,점퍼 숏다운 패딩 숏자켓 깡스타일리스트 플랙온라인단독다운점퍼 온라인단독다운점퍼,Faux Fur Female Furry Jackets Long Sleeved Quilted Turtlenecks,더블 리스 리버 시브 다운 점퍼 블랙 점퍼 숏 다운 패딩 깡 스타일 리스트 온라인 단독 다운 점퍼 
1728,무신사 스탠다드(MUSINSA STANDARD) 구스 다운 푸퍼 숏 패딩 재킷 [라이트 그레이],https://store.musinsa.com/app/goods/1648073,top,short padding,winter,casual,남,푸퍼다운 헤비다운 숏다운 숏푸퍼 다운자켓 구스 구스다운 프리미엄컬렉션 헤비아우터컬렉션 무탠픽업,Long Sleeved Male,신사 다운 숏 패딩 재킷 라이트 그레이 헤비 다운 숏 다운 숏 프리미엄 컬렉션 헤비 아우 터 컬렉션 무태 픽업 
1729,에르노(HERNO) (PI0595D 12017 1985) 여성 패딩 22SS,https://store.musinsa.com/app/goods/2535760,top,short padding,winter,casual,남,패딩,Female Furry Long Sleeved,에르 노 여성 패딩 SS 패딩 
1730,프리즘웍스(FRIZMWORKS) VELVET GOOSE DOWN JUMPER _ BLACK,https://store.musinsa.com/app/goods/892821,top,short padding,winter,casual,남,구스다운 벨벳 숏다운 숏패딩 패딩 헤비아우터,Female Furry Jackets Long Sleeved,벨벳 숏 다운 숏 패딩 패딩 헤비 아우 터 
1731,크럼프(CRUMP) 벨벳 리버시블 덕다운 숏패딩 (CO0032),https://store.musinsa.com/app/goods/1174209,top,short padding,winter,casual,남,덕다운 패딩점퍼 숏패딩 헤비아우터 점퍼 다운 패딩,Female Furry Long Sleeved,벨벳 리버 시브 덕 다운 숏 패딩 덕 다운 패딩 점퍼 숏 패딩 헤비 아우 터 점퍼 다운 패딩 
1732,벤틀리골프(BENTLEY GOLF) Cloud Short Duck down padding,https://store.musinsa.com/app/goods/2539570,top,short padding,winter,casual,여,윈드브레이커 숏패딩 패딩 덕다운,Faux Fur Female Furry Long Sleeved,벤틀리 골프 윈드 브레이커 숏 패딩 패딩 덕 다운 
1733,와릿이즌(WHATITISNT) 엔젤 RDS 덕 다운 숏 푸퍼 그레이,https://store.musinsa.com/app/goods/1536076,top,short padding,winter,casual,남,덕다운 패딩 다운 엔젤로고 헤비아우터 RDS덕다운 숏패딩,Long Sleeved,엔젤 덕 다운 숏 그레이 덕 다운 패딩 다운 엔젤 로고 헤비 아우 터 덕 다운 숏 패딩 
1734,나이키(NIKE) 우먼 써마핏 레펠 후드디 패딩 자켓 DJ6995-100,https://store.musinsa.com/app/goods/2508745,top,short padding,winter,casual,남,,Female Long Sleeved White,나이키 우먼 레페 후드 디 패딩 
